Drug,ADR_all,ADR_top5,Quality,Fold
пентафлуцин,Головокружение; Гиперчувствительность,Головокружение; Гиперчувствительность,"хороший, но есть побочные реакции",1
хиберикс,,,хороший,1
панадол,"Кожное раздражение; Сыпь, макулезная; Отрыжка","Кожное раздражение; Сыпь, макулезная; Отрыжка",плохой,3
катадолон,Вялость; Сомнолентность; Боль; очень сильно влияет на обменные процессы; Исажения при проведении лабораторных исследований; Нарушение гормонального уровня; Нарушение со стороны печени,Вялость; Сомнолентность; Боль; очень сильно влияет на обменные процессы; Исажения при проведении лабораторных исследований,плохой,1
экстракт алоэ жидкий,,,хороший,5
витамин а,,,хороший,1
мексидол,Сомнолентность; Плач; Головокружение; Абстинентный синдром; Бессонница,Сомнолентность; Плач; Головокружение; Абстинентный синдром; Бессонница,"плохой, частые побочные реакции",5
сульсен,Кожное раздражение,Кожное раздражение,"плохой, частые побочные реакции",5
отривин,Зависимость; Головная боль; Дискомфорт; Одышка; Зависимость от психоактивных веществ/лекарственных препаратов,Зависимость; Головная боль; Дискомфорт; Одышка; Зависимость от психоактивных веществ/лекарственных препаратов,плохой,2
преднизолон,"Сыпь, макулезная; Гиперчувствительность; Отек лица; Увеличение веса; Усиление аппетита; Повышение уровня глюкозы в крови; Расстройство зрения; Аффективная лабильность; Даже легкие раны очень медленно заживают; Депрессия; Остеонекроз; Снижение уровня калия в крови; Патология желудочно-кишечного тракта; Перепады настроения; Тахикардия; Угри; Нарушение со стороны иммунной системы; Себорея; Плач; Расстройство личности; Кожные стрии; Костная денситометрия","Сыпь, макулезная; Гиперчувствительность; Отек лица; Увеличение веса; Усиление аппетита","плохой, частые побочные реакции",5
вибуркол,,,хороший,1
лемсип макс,Сомнолентность,Сомнолентность,"плохой, частые побочные реакции",4
санвал,Зависимость; Дискомфорт в голове; Переносимость препарата,Зависимость; Дискомфорт в голове; Переносимость препарата,"плохой, частые побочные реакции",5
прогестерона,"Настроение измененное; Болезненная чувствительность молочных желез; Чувство угнетения; Пигментация, нарушение; Боль в месте инъекции; Гематома","Настроение измененное; Болезненная чувствительность молочных желез; Чувство угнетения; Пигментация, нарушение; Боль в месте инъекции","плохой, частые побочные реакции",2
шиповника сироп,,,хороший,3
гриппофлю экстра,,,хороший,5
люголь,Нарушение со стороны печени; Стеноз гортани; Аллергия на йод; Асфиксия; Ангиоотек; Раздражение горла; Тошнота,Нарушение со стороны печени; Стеноз гортани; Аллергия на йод; Асфиксия; Ангиоотек,"плохой, частые побочные реакции",2
варилрикс,Психомоторная гиперактивность; Боль в месте инъекции; Непереносимость препарата; Нарушение походки; Ощущение холода; Плач; Бессонница,Психомоторная гиперактивность; Боль в месте инъекции; Непереносимость препарата; Нарушение походки; Ощущение холода,плохой,2
трихопол,Абдоминальный дискомфорт; Изменение окраски зуба; Сыпь; Рвота; Снижение аппетита; Нарушение со стороны печени; Тошнота; Гипогидроз; Сомнолентность; Зубной кариес; Нарушение внимания,Абдоминальный дискомфорт; Изменение окраски зуба; Сыпь; Рвота; Снижение аппетита,"плохой, частые побочные реакции",3
цифран,Снижение аппетита; Тошнота; Боль в животе; Дисгевзия,Снижение аппетита; Тошнота; Боль в животе; Дисгевзия,"плохой, частые побочные реакции",1
сумамед форте,Дисгевзия; Нарушение со стороны печени,Дисгевзия; Нарушение со стороны печени,"плохой, частые побочные реакции",5
бадяга форте,Кожный зуд в месте применения; Зуд; Эритема; Приливы крови,Кожный зуд в месте применения; Зуд; Эритема; Приливы крови,"плохой, частые побочные реакции",5
нистатиновая мазь,,,хороший,2
нистатин,,,хороший,1
альтабор,,,хороший,5
доктор мом,,,хороший,2
"базирон ас"" 5%",Кожное раздражение; Химический ожог кожи,Кожное раздражение; Химический ожог кожи,"плохой, частые побочные реакции",3
диазолин,Сомнолентность; Усталость; Головокружение; Раздражение стенки желудочно-кишечного тракта; Сухость во рту; Отек; Периферический отек; Гиперчувствительность,Сомнолентность; Усталость; Головокружение; Раздражение стенки желудочно-кишечного тракта; Сухость во рту,"плохой, частые побочные реакции",5
галстен,Усталость; Головокружение; Раздражение стенки желудочно-кишечного тракта; Сомнолентность; Сухость во рту; Боль в животе,Усталость; Головокружение; Раздражение стенки желудочно-кишечного тракта; Сомнолентность; Сухость во рту,"плохой, частые побочные реакции",4
винпотропил,Тахикардия; Нежелательная лекарственная реакция; Ажитация; Недомогание; Головокружение; Головная боль,Тахикардия; Нежелательная лекарственная реакция; Ажитация; Недомогание; Головокружение,плохой,3
кровохлебки корневища и корни,,,"плохой, не помогает",4
оциллококцинум,,,"плохой, не помогает",4
железо,Запор; Раздражение стенки желудочно-кишечного тракта; Боль; Боль в животе,Запор; Раздражение стенки желудочно-кишечного тракта; Боль; Боль в животе,"плохой, частые побочные реакции",5
фолиевая кислота,Запор; Раздражение стенки желудочно-кишечного тракта; Боль; Боль в животе,Запор; Раздражение стенки желудочно-кишечного тракта; Боль; Боль в животе,"плохой, частые побочные реакции",5
ферретаб,Запор; Раздражение стенки желудочно-кишечного тракта; Боль; Боль в животе; Дисгевзия,Запор; Раздражение стенки желудочно-кишечного тракта; Боль; Боль в животе; Дисгевзия,"плохой, частые побочные реакции",3
почечный сбор,плохо влияет на почки; Почечная колика; песок в почках; пострадать почки,плохо влияет на почки; Почечная колика; песок в почках; пострадать почки,"плохой, частые побочные реакции",5
вернисон,,,"плохой, не помогает",2
ferrer нуклео ц.м.ф. форте,,,"плохой, не помогает",2
кестина,Крапивница; Гиперчувствительность; Сыпь,Крапивница; Гиперчувствительность; Сыпь,плохой,1
иберогаст,Крапивница; Гиперчувствительность; Сыпь; Голод; Диспепсия; Боль в животе,Крапивница; Гиперчувствительность; Сыпь; Голод; Диспепсия,плохой,3
боярышник,Сомнолентность; Недомогание; Головная боль; Усталость,Сомнолентность; Недомогание; Головная боль; Усталость,"хороший, но есть побочные реакции",2
изотроин 20,Сухая кожа; сильные высыпания,Сухая кожа; сильные высыпания,"плохой, частые побочные реакции",2
амитриптилина гидрхлорид,Сомнолентность; Увеличение веса; Состояние спутанности сознания; Колебания артериального давления; Зависимость; Головокружение; Отечность,Сомнолентность; Увеличение веса; Состояние спутанности сознания; Колебания артериального давления; Зависимость,"плохой, частые побочные реакции",1
максиколд,,,хороший,5
амизон макс,Боль в печени; Гиперчувствительность; Дисгевзия; Рвота,Боль в печени; Гиперчувствительность; Дисгевзия; Рвота,плохой,1
антифлу,Сомнолентность; Гиперчувствительность; Расстройство сна,Сомнолентность; Гиперчувствительность; Расстройство сна,"хороший, но есть побочные реакции",4
хьюмекс,,,хороший,4
фармазолин,Переносимость препарата,Переносимость препарата,"плохой, частые побочные реакции",5
мильгамма,Эритема; Угри,Эритема; Угри,плохой,3
сироп шиповника,,,хороший,3
l-тироксин берлин-хеми,Тахикардия,Тахикардия,плохой,3
атаракс,Сомнолентность; Агрессия; Бессонница; Апатия; Плохое самочувствие; Дискомфорт в голове; Недомогание; Недостаточность сна; Астения,Сомнолентность; Агрессия; Бессонница; Апатия; Плохое самочувствие,плохой,3
биоарон с,"Сыпь, макулезная; Гиперчувствительность","Сыпь, макулезная; Гиперчувствительность","плохой, не помогает",5
ирифрин,Боль кожных покровов,Боль кожных покровов,плохой,1
громецин,,,"плохой, не помогает",4
тенториум,Бронхит; Ринит; Синусит; Ларингит,Бронхит; Ринит; Синусит; Ларингит,плохой,4
лавакол,Сенсорное расстройство; Флатуленция; Тошнота; Болезненные позывы к дефекации; Дискомфорт в аноректальной области; Увеличение веса; Запор; Рвота; Отек,Сенсорное расстройство; Флатуленция; Тошнота; Болезненные позывы к дефекации; Дискомфорт в аноректальной области,"плохой, частые побочные реакции",2
флит,Сенсорное расстройство; Флатуленция; Тошнота; Болезненные позывы к дефекации,Сенсорное расстройство; Флатуленция; Тошнота; Болезненные позывы к дефекации,плохой,5
мебикар ic,,,хороший,4
экспортал,Вздутие живота; Периферический отек,Вздутие живота; Периферический отек,плохой,4
азибиот,Вялость; Усталость; Сомнолентность; Тошнота,Вялость; Усталость; Сомнолентность; Тошнота,"плохой, частые побочные реакции",5
ибупрофен,Боль в верхних отделах живота; Патология желудка; Гиперчувствительность; Сыпь; Гиперчувствительность к лекарственному препарату; Абдоминальный дискомфорт,Боль в верхних отделах живота; Патология желудка; Гиперчувствительность; Сыпь; Гиперчувствительность к лекарственному препарату,"плохой, частые побочные реакции",1
аевит,"Гиперчувствительность; Зуд; Фотодерматоз; сыпь на открытых участках кожи: лице, шее, груди","Гиперчувствительность; Зуд; Фотодерматоз; сыпь на открытых участках кожи: лице, шее, груди","плохой, частые побочные реакции",3
нюду,Тремор; Боль кожных покровов; Гиперчувствительность,Тремор; Боль кожных покровов; Гиперчувствительность,"плохой, частые побочные реакции",2
пара плюс,Тремор; Боль кожных покровов; Гиперчувствительность,Тремор; Боль кожных покровов; Гиперчувствительность,"плохой, частые побочные реакции",5
ксилометазолин,Сухость в носу; Эритема; Зуд; Заложенность носа; Отек носовых пазух; Абстинентный синдром; Переносимость препарата; Ринорея; Чувство жжения,Сухость в носу; Эритема; Зуд; Заложенность носа; Отек носовых пазух,"плохой, частые побочные реакции",2
лазолван,Дискомфорт в носу,Дискомфорт в носу,плохой,4
гидрокортизон,Боль в месте применения; Угри; Нарушение со стороны поджелудочной железы,Боль в месте применения; Угри; Нарушение со стороны поджелудочной железы,"плохой, частые побочные реакции",3
валосердин,Сомнолентность,Сомнолентность,"плохой, не помогает",3
лисобакт,Нарушение речи; Воспаление глотки; Асфиксия; Парестезия глотки,Нарушение речи; Воспаление глотки; Асфиксия; Парестезия глотки,плохой,2
perfectil,Тошнота; Диспепсия,Тошнота; Диспепсия,"плохой, частые побочные реакции",1
мирамистина,,,хороший,4
vicks active sinex,Переносимость препарата,Переносимость препарата,"плохой, частые побочные реакции",1
трависилом,,,"плохой, не помогает",3
strepsils,Стоматит; Припухлость рта; Эритема слизистой оболочки ротовой полости; Сенсорное расстройство; Дискомфорт в ротовой полости; Эксфолиация кожи; Изъязвление в полости рта; Гипестезия полости рта,Стоматит; Припухлость рта; Эритема слизистой оболочки ротовой полости; Сенсорное расстройство; Дискомфорт в ротовой полости,плохой,2
уролесан,Желудочно-кишечная боль; Патология желудка; Тошнота,Желудочно-кишечная боль; Патология желудка; Тошнота,плохой,5
темпалгин,Головная боль,Головная боль,"плохой, частые побочные реакции",3
флуконазол,Смерть; Желтуха; Гепатит; Изменение цвета кожи; Нарушение со стороны печени; Колебания артериального давления; Боль; Головная боль; Головокружение; Продуктивный кашель; Боль в животе; Запор; Флатуленция; Ощущение инородного тела; Тошнота,Смерть; Желтуха; Гепатит; Изменение цвета кожи; Нарушение со стороны печени,плохой,4
дифлюкан,Смерть; Желтуха; Гепатит; Изменение цвета кожи; Нарушение со стороны печени; Колебания артериального давления; Боль; Головная боль; Головокружение; Продуктивный кашель; Боль в животе; Запор; Флатуленция; Ощущение инородного тела; Тошнота,Смерть; Желтуха; Гепатит; Изменение цвета кожи; Нарушение со стороны печени,плохой,4
нобен,Головная боль; Нарушение засыпания,Головная боль; Нарушение засыпания,"хороший, но есть побочные реакции",3
альтевир,Гиперчувствительность; Зуд; Повышенная температура тела; Пирексия; Головная боль; Депрессия; Безразличие; Повышение артериального давления; Настроение измененное; Апатия; Расстройство сна,Гиперчувствительность; Зуд; Повышенная температура тела; Пирексия; Головная боль,"плохой, частые побочные реакции",3
кофеин бензоат натрия,Боль в месте инъекции; Гематома в месте инъекции; Бессонница; Паническая реакция; Мечтательность; Тремор; Гипергидроз; Сердечно-сосудистая патология,Боль в месте инъекции; Гематома в месте инъекции; Бессонница; Паническая реакция; Мечтательность,"плохой, частые побочные реакции",3
облепиховое масло,Психомоторная гиперактивность; Сердцебиение; Расстройство зрения; Дискомфорт в аноректальной области; Мышечные спазмы,Психомоторная гиперактивность; Сердцебиение; Расстройство зрения; Дискомфорт в аноректальной области; Мышечные спазмы,"плохой, частые побочные реакции",1
красавки экстракт,Психомоторная гиперактивность; Сердцебиение; Расстройство зрения; Дискомфорт в аноректальной области; Мышечные спазмы,Психомоторная гиперактивность; Сердцебиение; Расстройство зрения; Дискомфорт в аноректальной области; Мышечные спазмы,"плохой, частые побочные реакции",2
меласон,,,хороший,1
бондормин,,,хороший,3
нейрофулол,Паническая реакция; Зуд; проблемы с ЖКХ; Паранойя; Бессонница,Паническая реакция; Зуд; проблемы с ЖКХ; Паранойя; Бессонница,плохой,4
зорекс,Изъязвление в полости рта; Зуд; Припухлость губ; Гиперчувствительность,Изъязвление в полости рта; Зуд; Припухлость губ; Гиперчувствительность,"плохой, частые побочные реакции",1
сингуляр,Низкое качество сна; Кошмары; Стенание; Нервозность,Низкое качество сна; Кошмары; Стенание; Нервозность,плохой,1
папазол,Гиперчувствительность,Гиперчувствительность,"плохой, частые побочные реакции",2
кора дуба,,,хороший,1
тысячелистника трава,,,хороший,2
одуванчика лекарственного трава,,,хороший,1
хвоща трава,,,хороший,2
гексорал,Боль; Гипестезия глотки; Гиперсекреторное слезоотделение,Боль; Гипестезия глотки; Гиперсекреторное слезоотделение,плохой,5
метипред,Увеличение веса; Дисгевзия; Аффективная лабильность; Даже легкие раны очень медленно заживают; Депрессия; Остеонекроз; Снижение уровня калия в крови; Патология желудочно-кишечного тракта; Перепады настроения; Тахикардия; Угри; Нарушение со стороны иммунной системы; Себорея; Плач; Расстройство личности; Кожные стрии; Костная денситометрия,Увеличение веса; Дисгевзия; Аффективная лабильность; Даже легкие раны очень медленно заживают; Депрессия,"плохой, частые побочные реакции",3
травопассит,,,"плохой, не помогает",5
аллопуринол,Диарея; Тошнота; Боль в животе,Диарея; Тошнота; Боль в животе,плохой,4
леркамен,Одышка; Сердцебиение; Отек,Одышка; Сердцебиение; Отек,"плохой, частые побочные реакции",3
регецин,Сухая кожа; Гиперчувствительность; Угри,Сухая кожа; Гиперчувствительность; Угри,"плохой, частые побочные реакции",1
