Drug,ADR_all,ADR_top5,Quality,Fold
омез,Панкреатит; Гепатит; Головная боль; Патология желудка; Увеличение веса; Дискомфорт в эпигастральной области; замедляет метаболизм обмен веществ пищеварение; Усиление аппетита; ощущение будто поджелудочную разъедает; Тошнота; Диспепсия; Боль в печени; Миалгия; Боль в верхних отделах живота; Снижение аппетита; Сомнолентность; Бессонница; Аффективная лабильность; Даже легкие раны очень медленно заживают; Депрессия; Остеонекроз; Снижение уровня калия в крови; Патология желудочно-кишечного тракта; Перепады настроения; Тахикардия; Угри; Нарушение со стороны иммунной системы; Себорея; Плач; Расстройство личности; Кожные стрии; Костная денситометрия; Запор; Гипестезия; Боль; Чувство жжения; Желудочно-кишечная боль,Панкреатит; Гепатит; Головная боль; Патология желудка; Увеличение веса,"плохой, частые побочные реакции",5
валацикловир,,,хороший,1
гонадотропин хорионический,Боль внизу живота; Астения; Киста яичника; Боль со стороны спины,Боль внизу живота; Астения; Киста яичника; Боль со стороны спины,плохой,1
хгч,Боль внизу живота; Астения; Киста яичника; Боль со стороны спины,Боль внизу живота; Астения; Киста яичника; Боль со стороны спины,плохой,1
липстер,,,"плохой, не помогает",5
соннат,Переносимость препарата; Депрессия; Чувство угнетения; Астения; Раздражительность; Сомнолентность,Переносимость препарата; Депрессия; Чувство угнетения; Астения; Раздражительность,"плохой, частые побочные реакции",5
кларитин,Гиперчувствительность,Гиперчувствительность,"плохой, частые побочные реакции",5
валерин кардио,,,хороший,1
сафоцид,,,хороший,2
селанк,,,хороший,2
силурон,,,хороший,2
цетиризин-obl,Ощущение жара; Гиперчувствительность; Пирексия; Гипакузия; Ажитация; Астения; Сомнолентность,Ощущение жара; Гиперчувствительность; Пирексия; Гипакузия; Ажитация,"плохой, частые побочные реакции",3
цетрин,Сомнолентность; Ощущение жара; Гиперчувствительность; Пирексия; Гипакузия; Ажитация; Астения; Снижение уровня сознания,Сомнолентность; Ощущение жара; Гиперчувствительность; Пирексия; Гипакузия,"плохой, частые побочные реакции",1
акатинол мемантин,Расстройство поведения; Чувство тревоги; Отек легких; Онихомикоз; Сомнолентность,Расстройство поведения; Чувство тревоги; Отек легких; Онихомикоз; Сомнолентность,плохой,1
эскузан,Абдоминальный дискомфорт; Диспепсия,Абдоминальный дискомфорт; Диспепсия,плохой,1
линкас орви,,,хороший,1
орви колд,,,хороший,1
санорин,Раздражение горла; Гиперчувствительность; Рвота,Раздражение горла; Гиперчувствительность; Рвота,плохой,4
вита-мелатонин,,,"плохой, не помогает",4
мема,"Агрессия; Чувство тревоги; Состояние спутанности сознания; Галлюцинации, зрительные","Агрессия; Чувство тревоги; Состояние спутанности сознания; Галлюцинации, зрительные",плохой,1
"пластырь vitaplast ""украинский с перцем №1",Боль кожных покровов; Жжение в месте медицинского изделия; Приливы крови,Боль кожных покровов; Жжение в месте медицинского изделия; Приливы крови,"плохой, частые побочные реакции",3
триджекс,Умственная усталость; Нарушение работоспособности; Плохое самочувствие; Ступор; Брадифрения,Умственная усталость; Нарушение работоспособности; Плохое самочувствие; Ступор; Брадифрения,"плохой, частые побочные реакции",2
arnebia,Боль в верхних отделах живота,Боль в верхних отделах живота,"плохой, частые побочные реакции",3
арнебия мультивитамин,Боль в верхних отделах живота,Боль в верхних отделах живота,"плохой, частые побочные реакции",1
сироп помогуша успокаивающий,,,"плохой, не помогает",3
зверобой,,,хороший,1
ципромед,Раздражение глаз; Боль в глазу; Зуд; Гиперсекреторное слезоотделение; Отек век,Раздражение глаз; Боль в глазу; Зуд; Гиперсекреторное слезоотделение; Отек век,"плохой, частые побочные реакции",4
таваник,Дискомфорт в голове; Боль в верхних отделах живота; Патология желудка; Флатуленция,Дискомфорт в голове; Боль в верхних отделах живота; Патология желудка; Флатуленция,"плохой, частые побочные реакции",4
асепта,Тошнота,Тошнота,плохой,3
эхинацеи трава,Эритема,Эритема,"плохой, частые побочные реакции",5
кедровый эффект,Диспепсия; Сухость во рту,Диспепсия; Сухость во рту,плохой,1
тонгинал,Переносимость препарата,Переносимость препарата,"плохой, частые побочные реакции",1
posay effaclar duo+,Сухая кожа; Боль в месте применения,Сухая кожа; Боль в месте применения,плохой,3
супрадин,Дискомфорт; Диспепсия; Диарея; Боль в верхних отделах живота; Зуд; Эксфолиация кожи,Дискомфорт; Диспепсия; Диарея; Боль в верхних отделах живота; Зуд,"плохой, частые побочные реакции",4
окситоцин-рихтер,Гипотонус матки; Гиперчувствительность,Гипотонус матки; Гиперчувствительность,"плохой, частые побочные реакции",1
окситоцина,Гипотонус матки; Гиперчувствительность,Гипотонус матки; Гиперчувствительность,"плохой, частые побочные реакции",2
актрапид,Нейропатия периферическая; Отек в месте инъекции; Отек; Крапивница; Нарушение рефракции; Гипогликемия; Сыпь; Диабетическая ретинопатия; Анафилактическая реакция; Боль; Боль в верхних отделах живота,Нейропатия периферическая; Отек в месте инъекции; Отек; Крапивница; Нарушение рефракции,"плохой, частые побочные реакции",1
инсулин,Нейропатия периферическая; Отек в месте инъекции; Отек; Крапивница; Нарушение рефракции; Гипогликемия; Сыпь; Диабетическая ретинопатия; Анафилактическая реакция,Нейропатия периферическая; Отек в месте инъекции; Отек; Крапивница; Нарушение рефракции,"плохой, частые побочные реакции",2
имудоном,Ухудшение состояния,Ухудшение состояния,"плохой, частые побочные реакции",5
эриспирус,Снижение артериального давления; Тахикардия; Астения; Сомнолентность; Головокружение; Частота сердечных сокращений выше нормы; Сердцебиение; Вялость,Снижение артериального давления; Тахикардия; Астения; Сомнолентность; Головокружение,"плохой, частые побочные реакции",2
ферлатум,Патология желудочно-кишечного тракта; Изменение цвета фекалий; Гиперемезис беременных; Боль в верхних отделах живота; Рвота,Патология желудочно-кишечного тракта; Изменение цвета фекалий; Гиперемезис беременных; Боль в верхних отделах живота; Рвота,плохой,5
биогая детские капли,Расстройство поведения; Боль в животе; Раздражительность; Плач; Бессонница,Расстройство поведения; Боль в животе; Раздражительность; Плач; Бессонница,плохой,1
фемибиона,Повышение уровня печеночных ферментов; Медикаментозное поражение печени; Нарушение со стороны печени; Холестаз; Гипотонус матки; Флатуленция,Повышение уровня печеночных ферментов; Медикаментозное поражение печени; Нарушение со стороны печени; Холестаз; Гипотонус матки,"плохой, частые побочные реакции",3
femibion,Повышение уровня печеночных ферментов; Медикаментозное поражение печени; Нарушение со стороны печени; Холестаз,Повышение уровня печеночных ферментов; Медикаментозное поражение печени; Нарушение со стороны печени; Холестаз,плохой,2
гинезол,Абдоминальный дискомфорт; Зуд; Цистит,Абдоминальный дискомфорт; Зуд; Цистит,плохой,5
ацилакт,Абдоминальный дискомфорт; Зуд; Цистит,Абдоминальный дискомфорт; Зуд; Цистит,плохой,4
азинтроп,Конъюнктивит,Конъюнктивит,плохой,3
флоксал,Конъюнктивит,Конъюнктивит,плохой,5
флюарикс,Повышенная температура тела,Повышенная температура тела,плохой,4
сульпирид,Повышение уровня пролактина в крови; Повышенная послеродовая лактация; Сомнолентность,Повышение уровня пролактина в крови; Повышенная послеродовая лактация; Сомнолентность,"плохой, частые побочные реакции",5
супракс солютаб,Снижение аппетита; Боль в верхних отделах живота; Дисбиоз; Сухость во рту,Снижение аппетита; Боль в верхних отделах живота; Дисбиоз; Сухость во рту,"плохой, частые побочные реакции",5
мемы,"Чувство тревоги; Состояние спутанности сознания; Галлюцинации, зрительные","Чувство тревоги; Состояние спутанности сознания; Галлюцинации, зрительные",плохой,3
имован,Дисгевзия; Депрессия; Интрасомническое расстройство; Ажитация; Сердцебиение,Дисгевзия; Депрессия; Интрасомническое расстройство; Ажитация; Сердцебиение,плохой,3
золофт,Зависимость; Паническая атака; Чувство угнетения; Большая депрессия; Чувство тревоги; Чувство отчаяния; Суицидальные мысли,Зависимость; Паническая атака; Чувство угнетения; Большая депрессия; Чувство тревоги,плохой,2
церукал,Брадикардия; Частота сердечных сокращений ниже нормы; Сомнолентность; Головная боль; Снижение аппетита; Астения; Тошнота; Снижение веса,Брадикардия; Частота сердечных сокращений ниже нормы; Сомнолентность; Головная боль; Снижение аппетита,"плохой, частые побочные реакции",4
звездочка флю,Гипестезия; Похмелье; Вялость; Головокружение; Сыпь; Нарушение походки,Гипестезия; Похмелье; Вялость; Головокружение; Сыпь,плохой,5
настойка березовых почек,,,"плохой, не помогает",1
бусерилин,Снижение либидо; Перепады настроения,Снижение либидо; Перепады настроения,"плохой, частые побочные реакции",2
лозап,Чувство угнетения; Плохое самочувствие,Чувство угнетения; Плохое самочувствие,плохой,1
наклофен,Сердцебиение; Боль в животе,Сердцебиение; Боль в животе,"плохой, частые побочные реакции",2
бисептол,Потеря сознания; Дисгевзия; Головокружение; Токсичное воздействие различных веществ; Тошнота,Потеря сознания; Дисгевзия; Головокружение; Токсичное воздействие различных веществ; Тошнота,"плохой, частые побочные реакции",2
бромокриптин,Головокружение; Потеря сознания; Головная боль; Запор; Тиннитус; Рвота; Тошнота; Заложенность носа; Частота сердечных сокращений выше нормы; Астения; Сомнолентность; Снижение артериального давления,Головокружение; Потеря сознания; Головная боль; Запор; Тиннитус,"плохой, частые побочные реакции",3
диакарб,Астения; Снижение уровня калия в крови,Астения; Снижение уровня калия в крови,"плохой, частые побочные реакции",4
аллергозан,Кожное раздражение; Зуд,Кожное раздражение; Зуд,"плохой, частые побочные реакции",5
линекс форте,Запор,Запор,"плохой, частые побочные реакции",5
будь здоров,Диарея; Боль в верхних отделах живота,Диарея; Боль в верхних отделах живота,плохой,3
бубо-кок,Одышка; Повышенная температура тела; Пирексия; Стеноз гортани,Одышка; Повышенная температура тела; Пирексия; Стеноз гортани,"плохой, частые побочные реакции",2
кеппра,Агрессия; Абстинентный синдром,Агрессия; Абстинентный синдром,плохой,2
пенцикловир,,,"плохой, не помогает",5
аторакс,Сомнолентность,Сомнолентность,"плохой, частые побочные реакции",3
кардофлекса,Сомнолентность; Снижение артериального давления; Головокружение; Астения,Сомнолентность; Снижение артериального давления; Головокружение; Астения,плохой,2
капотен,Сомнолентность; Снижение артериального давления; Головокружение; Астения; Головная боль; Повышение артериального давления,Сомнолентность; Снижение артериального давления; Головокружение; Астения; Головная боль,"плохой, частые побочные реакции",2
физиотензом,Сомнолентность; Снижение артериального давления; Головокружение; Астения,Сомнолентность; Снижение артериального давления; Головокружение; Астения,плохой,5
грандаксин,Сомнолентность; Снижение уровня сознания,Сомнолентность; Снижение уровня сознания,плохой,5
ксизал,Диарея; Ажитация; Сомнолентность,Диарея; Ажитация; Сомнолентность,"плохой, частые побочные реакции",4
эктерицид,Гиперсекреторное слезоотделение; Головная боль; Дискомфорт в носу,Гиперсекреторное слезоотделение; Головная боль; Дискомфорт в носу,плохой,5
немозол,Сыпь; Запор; Боль в печени,Сыпь; Запор; Боль в печени,"плохой, частые побочные реакции",5
амелотекс,Боль в месте инъекции; Чувство жжения,Боль в месте инъекции; Чувство жжения,"плохой, частые побочные реакции",4
кокарнит,Боль в месте инъекции; Чувство жжения,Боль в месте инъекции; Чувство жжения,"плохой, частые побочные реакции",2
хондрогард,Боль в месте инъекции; Чувство жжения,Боль в месте инъекции; Чувство жжения,"плохой, частые побочные реакции",5
нормазе,Флатуленция,Флатуленция,плохой,2
живокост (босвелия,Гиперчувствительность,Гиперчувствительность,"плохой, частые побочные реакции",4
живокости с пчелиным ядом,Гиперчувствительность,Гиперчувствительность,"плохой, частые побочные реакции",2
мульти макс,Боль в верхних отделах живота; Гастрит,Боль в верхних отделах живота; Гастрит,"плохой, частые побочные реакции",2
тридерм,Кожный зуд в месте применения,Кожный зуд в месте применения,"плохой, частые побочные реакции",5
клотримазол,Вагинальные выделения; Боль в месте применения; Чувство жжения; Зуд; Колебания артериального давления; Боль; Головная боль; Головокружение; Продуктивный кашель; Боль в животе; Запор; Флатуленция; Ощущение инородного тела; Тошнота,Вагинальные выделения; Боль в месте применения; Чувство жжения; Зуд; Колебания артериального давления,плохой,5
бактериофаг,"Сыпь, макулезная; Дерматит","Сыпь, макулезная; Дерматит",плохой,2
гендевит,Переносимость препарата,Переносимость препарата,"плохой, частые побочные реакции",4
экстракт эхинацеи,,,хороший,4
рапимед,Сомнолентность,Сомнолентность,плохой,4
белосалик,Переносимость препарата,Переносимость препарата,"плохой, частые побочные реакции",4
креон,Запор; Нежелательная лекарственная реакция; Зависимость от психоактивных веществ/лекарственных препаратов,Запор; Нежелательная лекарственная реакция; Зависимость от психоактивных веществ/лекарственных препаратов,"плохой, частые побочные реакции",4
фенотропил,Повышенное либидо; Усиление аппетита; Абдоминальный дискомфорт; Гипометаболизм,Повышенное либидо; Усиление аппетита; Абдоминальный дискомфорт; Гипометаболизм,плохой,4
витрум беби,Гиперчувствительность; Эксфолиация кожи,Гиперчувствительность; Эксфолиация кожи,плохой,5
виру-мерц серол,,,"плохой, не помогает",2
бадяга иван чай,Гиперчувствительность; Зуд; Изменение цвета кожи,Гиперчувствительность; Зуд; Изменение цвета кожи,"плохой, частые побочные реакции",3
париет,Боль; Боль в животе,Боль; Боль в животе,плохой,4
доппельгерц актив с магнием и витаминами группы в,Снижение артериального давления,Снижение артериального давления,"плохой, частые побочные реакции",1
газоспазам,Сомнолентность; Сухость во рту,Сомнолентность; Сухость во рту,"плохой, частые побочные реакции",5
меmoria,Переносимость препарата,Переносимость препарата,плохой,3
омарон,Переносимость препарата; Сомнолентность; Головная боль,Переносимость препарата; Сомнолентность; Головная боль,"плохой, частые побочные реакции",3
серрата,Гепатомегалия; Дисгевзия; Диспепсия; Эрозивный гастрит,Гепатомегалия; Дисгевзия; Диспепсия; Эрозивный гастрит,плохой,1
левомиколь,Гепатомегалия; Дисгевзия; Диспепсия; Эрозивный гастрит,Гепатомегалия; Дисгевзия; Диспепсия; Эрозивный гастрит,плохой,3
